{
  "ns": "github",
  "name": "rest-api",
  "title": "GitHub REST API",
  "tagline": "Core endpoints of the GitHub REST API.",
  "category": "devops",
  "featured": true,
  "versions": [
    {
      "version": "1.0.0",
      "type": "git",
      "source": {
        "repo": "https://github.com/gopu-bruno/bruno-collections",
        "subdir": "github-rest-api",
        "ref": "main"
      }
    }
  ]
}
