{
  "ns": "gopu-bruno",
  "name": "notion-api",
  "title": "Notion API",
  "category": "payments",
  "versions": [
    {
      "version": "1.0.0",
      "type": "git",
      "source": {
        "repo": "https://github.com/gopu-bruno/bruno-collections",
        "subdir": "notion-notion-api"
      }
    }
  ]
}
