{
  "ns": "algolia",
  "name": "search-api",
  "title": "Algolia Search API",
  "tagline": "Indexing, search and recommend.",
  "category": "data",
  "trending": true,
  "versions": [
    {
      "version": "1.0.0",
      "type": "git",
      "source": {
        "repo": "https://github.com/gopu-bruno/bruno-collections",
        "subdir": "algolia-search-api",
        "ref": "main"
      }
    }
  ]
}
