{
  "ns": "gopu-bruno",
  "name": "auth0-management-api",
  "title": "Auth0 Management API",
  "category": "payments",
  "versions": [
    {
      "version": "1.0.0",
      "type": "git",
      "source": {
        "repo": "https://github.com/gopu-bruno/bruno-collections",
        "subdir": "auth0-management-api"
      }
    }
  ]
}
