{
  "ns": "datadog",
  "name": "api",
  "title": "Datadog API",
  "tagline": "Metrics, monitors, logs and dashboards.",
  "category": "devops",
  "trending": true,
  "versions": [
    {
      "version": "1.0.0",
      "type": "git",
      "source": {
        "repo": "https://github.com/gopu-bruno/bruno-collections",
        "subdir": "datadog-api",
        "ref": "main"
      }
    }
  ]
}
