{
  "ns": "gopu-bruno",
  "name": "twilio-messaging",
  "title": "Twilio Messaging",
  "category": "payments",
  "versions": [
    {
      "version": "1.0.0",
      "type": "git",
      "source": {
        "repo": "https://github.com/gopu-bruno/bruno-collections",
        "subdir": "twilio-messaging"
      }
    }
  ]
}
